album,title,singer,timespan,lyrics
Hushed and Grim,pushing-the-tides,Brann Dailor,7, Pushing the tides  With every ounce of strength I have 
Hushed and Grim,savage-lands,Brann Dailor,23,  Running from an endless source of everlasting light  Stumble into darkness of my own creation  Navigate this maze of self-destruction's inner glow  Worship at the feet of primal gods of chaos  
Hushed and Grim,savage-lands,Troy Sanders,32,  The walls we create  The cracks will begin to show  And watch them start to fall  All is indefinite  How quickly we evaporate  To memories and only dreams  As the seismic shifts  Veering into unknown space  Where monuments will bare your name  
Hushed and Grim,savage-lands,Brann Dailor,22,  Drinking from reflections in the pool of endless doubt  Continue on the path of reckless devastation  In the pit of death and bones and carcasses decayed  It's here I find a guiding hand to true salvation  
Hushed and Grim,savage-lands,Troy Sanders,57,"  Push through the pain  Developing calloused hands  To dig, scrape and claw  Thought and visions stick  The images, how they still burn  Cementing of your legacy  Now it's flooding back  Trigger the unlocking fate  To wash away and letting free Dredging the weight  Dragging through hollow ground  To break the chain of lies' Round and 'round, we battle ourselves  Silencing our tongues "
Hushed and Grim,sickle-and-peace,Troy Sanders,29,  Please excuse the madness  Of the situation I am in  Are we reunited? For we both share the cause of this  
Hushed and Grim,sickle-and-peace,Troy Sanders,31,  You choose to apply logic  It's hard to ply where there is none  My destination's unknown  Allow the man to walk in his shoes from here  
Hushed and Grim,sickle-and-peace,Brann Dailor,22,  Death comes and brings with him sickle and peace  Shelter from storms come with long flowing robes  
Hushed and Grim,sickle-and-peace,Troy Sanders,30,  Justifying all your control  I cease to mourn what never could be  No feeling's ever final  Just another scar I wear and hold dear  
Hushed and Grim,sickle-and-peace,Brann Dailor,21,  Death comes and brings with him sickle and peace  Shelter from storms come with long flowing robes  
Hushed and Grim,sickle-and-peace,Troy Sanders,22,  Falling down and losing ground  Save me from myself  All I've seen and all I know I've not been this low  
Hushed and Grim,sickle-and-peace,Troy Sanders,22,  Now I stand up on my own  Learning from myself  Where I've been and where I'll go Still remains unknown  
Hushed and Grim,sickle-and-peace,Brann Dailor,21,  Death comes and brings with him sickle and peace  Shelter from storms come with long flowing robes 
Hushed and Grim,skeleton-of-splendor,Troy Sanders,47,"  You reached two hands outward  Two birds spreading our wings  Today's arms turn numb  When I turn it inward  We live and breathe all your thousand words  Now you sleep, we'll finish your work  "
Hushed and Grim,skeleton-of-splendor,Troy Sanders,29,  To my detriment  To my detriment  To my detriment (I forge ahead unscarred) To my detriment  
Hushed and Grim,skeleton-of-splendor,Brann Dailor,29,  To my detriment  To my detriment  To my detriment (I forge ahead unscarred) To my detriment  
Hushed and Grim,skeleton-of-splendor,Troy Sanders,64,"  You painted us with effort  Always praising us high  The day has come to face the storm  As lightning strikes me in two  We live the dream onward as it were  Endless days we'll carry on as one  There's no doubt of what we're her to do  You laid it out, a promise of yourself  "
Hushed and Grim,skeleton-of-splendor,Troy Sanders,25,  To my detriment  To my detriment (I forge ahead unscarred) To my detriment (I forge ahead unscarred) To my detriment  
Hushed and Grim,skeleton-of-splendor,Brann Dailor,25,  To my detriment  To my detriment (I forge ahead unscarred) To my detriment (I forge ahead unscarred) To my detriment  
Hushed and Grim,skeleton-of-splendor,Troy Sanders,26,  To my detriment (I forge ahead unscarred) To my detriment (I forge ahead unscarred) To my detriment (I forge ahead unscarred) To my detriment 
Hushed and Grim,skeleton-of-splendor,Brann Dailor,26,  To my detriment (I forge ahead unscarred) To my detriment (I forge ahead unscarred) To my detriment (I forge ahead unscarred) To my detriment 
Hushed and Grim,teardrinker,Brann Dailor,29, Within a bruised heart I'll just say when  Just one time before  It will come again  Little voice inside  Inside my head  Tell me when it's time to turn around again  
Hushed and Grim,teardrinker,Troy Sanders,5, All appears to fade away  
Hushed and Grim,teardrinker,Brann Dailor,28,  I can see your face  And I feel the pain  And I feel the shame that I have let you down again  People everywhere  Not a drop to drink  Not a dare to think about the damage I have done  
Hushed and Grim,teardrinker,Brann Dailor,29, Try to give up what weighs  What weighs you down  The only control you have  Is all your own  Do I fit the pieces  Together again  Or do I leave them lying on the floor? 
Hushed and Grim,teardrinker,Troy Sanders,4,  All appears to fade away  
Hushed and Grim,teardrinker,Brann Dailor,30,  I can see your face  And I feel the pain  And I feel the shame that I have let you down again  People everywhere  Not a drop to drink  Not a dare to think about the damage I have done  
Hushed and Grim,teardrinker,Troy Sanders,32,  Leaving you behind  Is the hardest thing  I've done  Asking where did I go wrong? I wonder what all of this makes  Does fortune favor the bold? I only know that leaving you  Was the hardest thing  To cut and run  
Hushed and Grim,teardrinker,Brann Dailor,32,  Leaving you behind  Is the hardest thing  I've done  Asking where did I go wrong? I wonder what all of this makes  Does fortune favor the bold? I only know that leaving you  Was the hardest thing  To cut and run  
Hushed and Grim,teardrinker,Brann Dailor,28,  I can see your face  And I feel the pain And I feel the shame that I have let you down again  People everywhere  Not a drop to drink  Not a dare to think about the damage I have done 
Hushed and Grim,the-beast,Brent Hinds,33, I'm out of my mind  Pictures of past lives  Trapped in a memory  In fragments of time  The way things used to be  Find a better way to get back home  Reaching for something new  That's just not there anymore 'cause you know that it's gone  
Hushed and Grim,the-beast,Brent Hinds,31," You slip away to the distance  Pass a crack of light in the floor  I hear the sound of mischief  As the promising light shines some more  I paid you in fool's gold, and I don't owe you anymore  And I deserve nothing I find like a mountain of pain on the floor  "
Hushed and Grim,the-beast,Brann Dailor,27, Losing ground  Taken by a prophecy  Siren sounds  Calling for your sanctity  Wipe away  The blood from your face  
Hushed and Grim,the-beast,Troy Sanders,15, All I see is our demise  Headed for the blackened skies  And I need more time  
Hushed and Grim,the-beast,Brann Dailor,50, I still hear  The beast is breathing  Should I fall  Upon my sword? Make sure they know  That I fought for them  Make sure they know  They know I tried  I scraped and clawed  I gave my all  
Hushed and Grim,the-beast,Brent Hinds,46," Stars in the distance  Oh, how they tell a story of my life  And tell us to beware  Repeating the past  Nature is nocturnal and that is that  I spend my days underground covered in ash and smothered in dirt  And you know how it hurts this little clown  Pay no attention to the sound of the beast 'Cause you know it can't hurt you when you're with me "
Hushed and Grim,the-crux,Troy Sanders,34,  Another sinking stone  Finds its way down below  Resurface when only light will ever show  And while I progress slow  I'm soon to surpass you  Entitled to all possessions I have adored  I feel pressure  I feel the pressure  
Hushed and Grim,the-crux,Troy Sanders,35,  And all the faded bones  Piling up high and low  Returning to life once you can stand alone  Don't get too close this time  The depths of love haunt you  It's dark inside where all my demons hide  I feel pressure  I feel the pressure  
Hushed and Grim,the-crux,Troy Sanders,48,"  Waiting with patience of eons  Your presence fades into a memory  Underneath a cloud of silence, you journey into the rift  Will time defy the weight of you leaving us? "
Hushed and Grim,the-crux,Troy Sanders,21,  I feel pressure  I feel the pressure  Hold aggression  Hold aggression 
Leviathan,aqua-dementia,Brent Hinds,13, An invitation to clairvoyance It's hard to stand around and watch while they ignore us She is dumped on Used as an ashtray At the expense of an organized association 
Leviathan,aqua-dementia,Scott Kelly,4, I see the stones in the path we laid 
Leviathan,aqua-dementia,Brent Hinds,7, It's a question of tomorrow We like to breathe the ancient wind that we have followed 
Leviathan,aqua-dementia,Scott Kelly,4, A perfect fire to burn the land 
Leviathan,aqua-dementia,Brent Hinds,8, Before they knew it The sun had fallen Boiling the water where the hydra's crawling 
Leviathan,aqua-dementia,Scott Kelly,8, The righteous go in blazing fury 
Leviathan,aqua-dementia,Scott Kelly,6, And we cleanse the earth to bring it down 
Leviathan,aqua-dementia,Guest,2, Bring it down 
Leviathan,aqua-dementia,Scott Kelly,36, And God will watch it burn Releasing souls Within the wrath we wait To be dirt again 
Leviathan,aqua-dementia,Scott Kelly,23, There is a flame I lit I upon high 
Leviathan,blood-and-thunder,Troy Sanders,20, I think that someone is trying to kill me Infecting my blood and destroying my mind No man of the flesh could ever stop me The fight for this fish is a fight to the death 
Leviathan,blood-and-thunder,Troy Sanders,3, White whale - holy grail 
Leviathan,blood-and-thunder,Troy Sanders,4, White whale - holy grail 
Leviathan,blood-and-thunder,Troy Sanders,17, What remorseless emperor commands me I no longer govern my soul I am completely immersed in darkness As I turn my body away from the sun 
Leviathan,blood-and-thunder,Troy Sanders,6, White whale - holy grail 
Leviathan,blood-and-thunder,Troy Sanders,5, White whale - holy grail 
Leviathan,blood-and-thunder,Troy Sanders,40, Split your lungs with blood and thunder When you see the white whale Break your backs and crack your oars men If you wish to prevail This ivory leg is what propels me Harpoons thrust in the sky Aim directly for his crooked brow And look him straight in the eye 
Leviathan,blood-and-thunder,Troy Sanders,5, White whale - holy grail 
Leviathan,blood-and-thunder,Troy Sanders,5, White whale - holy grail 
Leviathan,hearts-alive,Troy Sanders,11, Taken down with hearts alive Our hearts alive 
Leviathan,hearts-alive,Troy Sanders,18, Lurking dark underground Descend to the bottom Swim below eternally Into the deep blue sea 
Leviathan,hearts-alive,Troy Sanders,18, Time and space All alone It can be a lonely place There it goes Opening up I can't stand I can't breathe 
Leviathan,hearts-alive,Troy Sanders,12, Rolled fin out Oil stripped Hold is filled 
Leviathan,hearts-alive,Troy Sanders,20, Ocean coil Water boils He swims to the surface Flame from mouth Smoke he breathes Enter the caverns of the deep 
Leviathan,hearts-alive,Troy Sanders,18, Time and space All alone It can be a lonely place There it goes Opening up I can't stand I can't breathe 
Leviathan,hearts-alive,Troy Sanders,21, Terrified Ghastly cry Spiraled lives Taken down Taken down 
Leviathan,hearts-alive,Troy Sanders,21, The iron side Bucket of lead Battle is she Not for defeat 
Leviathan,hearts-alive,Troy Sanders,13, The iron side Bucket of lead Battle is she 
Leviathan,i-am-ahab,Troy Sanders,34, There's magic in the water that attracts all men Across hills and down streams The turning of the tide 
Leviathan,i-am-ahab,Troy Sanders,16, Outlook Future bright Selfish Beauty shines 
Leviathan,i-am-ahab,Troy Sanders,2, Light cloud rain drive on 
Leviathan,i-am-ahab,Troy Sanders,18," 13 years to this day red planet aligned Into sight 60,000 years of light Fascination with a mountain put to sea Built to slay and conquer All with teeth of beasts "
Leviathan,iron-tusk,Troy Sanders,14, Straight line Feel it burst liver and lung Long and strong 'Til she spills her black blood 
Leviathan,iron-tusk,Troy Sanders,15, Center down Vast the head body and tail Shatter life Physeter catodon 
Leviathan,iron-tusk,Troy Sanders,13, Culture vulture Elephant graveyard 
Leviathan,iron-tusk,Brent Hinds,13, Culture vulture Elephant graveyard 
Leviathan,iron-tusk,Troy Sanders,4, Culture vulture 
Leviathan,iron-tusk,Brent Hinds,4, Culture vulture 
Leviathan,iron-tusk,Troy Sanders,19, Engage monster Wreaking vengeance Assault with all martial rage 
Leviathan,iron-tusk,Brent Hinds,19, Engage monster Wreaking vengeance Assault with all martial rage 
Leviathan,iron-tusk,Troy Sanders,2, Sail on 
Leviathan,iron-tusk,Brent Hinds,2, Sail on 
Leviathan,island,Brent Hinds,16, Given decision to live Not taken The flight towards the light I'll stay in the lava for life Erupting when gods take us all Changing the peaks makes us pour From the mountain and burn The path of our time 
Leviathan,island,Troy Sanders,24, Hail people of Iceland Journey of a land anew Ram as our liaison Vision inspire and move Awe holy island Breed the lagoon to run free Raw beauty is ruthless within the golden ring 
Leviathan,island,Troy Sanders,11, Precision of Grungir Spear of the Norse God Odin Praise our Pagan Father Founder of the Althing 
Leviathan,island,Brent Hinds,16, Given decision to live Not taken The flight towards the light I'll stay in the lava for life Erupting when gods take us all Changing the peaks makes us pour From the mountain and burn The path of our time 
Leviathan,island,Troy Sanders,13, Ruler of sky's thunder The honourable warrior All divination Beward the Hammer of Thor 
Leviathan,island,Troy Sanders,15, Lava goddess Ice and fire Settling down Ocean Geysir Gullfoss Heimaey '73 
Leviathan,megalodon,Troy Sanders,32, Myth or legend Nymph tale washed ashore Near the kraken sleepeth stirs coral and bone Infinite city No sexy sneer Hideous creation Human and animal Banter songs of rudeness to be adhered Not on rocks that glisten Harps to listen Comb hair Tear right to pieces Left to recess a watery grave 
Leviathan,megalodon,Troy Sanders,3, Sensing the blood of prey 
Leviathan,megalodon,Troy Sanders,25, Swimming in fear for life Rolling over Falling into jaws Teeth that chatter It distracts them all The Fiji mermaid She will let it know Time is coming to feed and knaw 
Leviathan,megalodon,Troy Sanders,18, Rolling over Falling into jaws Teeth that chatter It distracts them all The Fiji mermaid She will let it know Time is coming to feed and knaw 
Leviathan,naked-burn,Brent Hinds,20, Angels dancing with a mortal a sin A giant born within a woman's womb Nephilim walking through the forest breaking limbs As we bow and give respect to the gods 
Leviathan,naked-burn,Brent Hinds,19, Save yourself Don't wait on me 
Leviathan,naked-burn,Troy Sanders,4, My feet are sewn Endless bottom 
Leviathan,naked-burn,Brent Hinds,52, The church is burning from the inside out Altars falling into ashes again An eagle fly upon horizons with sight Focusing on all our family and friends Apologize Can we rise above it Climb the line It's a good endeavor The ships arrived Let's sail into the weather Our crying eyes Save yourself Don't wait on me 
Leviathan,naked-burn,Troy Sanders,3, My feet are sewn Endless bottom 
Leviathan,seabeast,Brent Hinds,26, If I stand around and watch them drown in a pool of gray When we dive in I can surely say there's feud with force Am I in your way? Please knock me down. Can I help you in? When I'm not around let us all be found in certain ways 
Leviathan,seabeast,Brent Hinds,26, Dear Mr. Queequeg you have been informed your life's been saved You are not a black-hearted vicious mess so it has been claimed If this is the beast pulling us towards the east with mighty waves Let us look inside and pull out all your pride you know it's up to us 
Leviathan,seabeast,Troy Sanders,20, Holding pasts in ash black earth Bound by roots Roots into sand Grow towards the giver 
Leviathan,seabeast,Brent Hinds,28," There's an open wound placed upon my heart in anger's rage If we open up a spirit, a spirit that can bleed Ahab the leading lad we can trust his obsession carries them Meet us at the temple healing all the crippled Don't forget the maimed "
Leviathan,seabeast,Troy Sanders,20, Lower soul sent with gifts offering Teeth of hope travel with Child laid next to mother 
Once More Round the Sun,asleep-in-the-deep,Brann Dailor,81," The moment you walked in the room my friend  The demons, they all went away  Be careful they're only asleep for a while  Pretending there's nothing to say  Throw salt in all the corners here  Make sure you watch him leave  Build up the walls around this house  And dig out the rot in the floor  Block out the entrance with brick and stone  And mortar that's made from coal  Crawl into this hole I've made  Transform these feelings of fear  "
Once More Round the Sun,asleep-in-the-deep,Brent Hinds,15, I'm on fire  Say you'll remember her voice  And I can't get you out of my mind  I'm on fire  Say you'll remember her voice  And I can't get you out of my mind  
Once More Round the Sun,asleep-in-the-deep,Brann Dailor,15, I'm on fire  Say you'll remember her voice  And I can't get you out of my mind  I'm on fire  Say you'll remember her voice  And I can't get you out of my mind  
Once More Round the Sun,asleep-in-the-deep,Troy Sanders,15, I'm on fire  Say you'll remember her voice  And I can't get you out of my mind  I'm on fire  Say you'll remember her voice  And I can't get you out of my mind  
Once More Round the Sun,asleep-in-the-deep,Troy Sanders,24, Loose lips have fallen on deaf ears  Loose lips have fallen on blind eyes  
Once More Round the Sun,asleep-in-the-deep,Brann Dailor,24, Loose lips have fallen on deaf ears  Loose lips have fallen on blind eyes  
Once More Round the Sun,asleep-in-the-deep,Brann Dailor,39, An ocean of sorrow surrounds this home  I hope that we make it to shore  As time chips away at the fortress walls  Its seems that we weathered the storm The sun begins to show itself  Revealing victory  
Once More Round the Sun,asleep-in-the-deep,Brann Dailor,30, I'm on fire  Say you'll remember her voice  And I can't get you out of my mind  I'm on fire  Say you'll remember her voice  And I can't get you out of my mind  I'm on fire  Say you'll remember her voice  And I can't get you out of my mind  I'm on fire  Say you'll remember her voice  And I can't get you out of my mind  
Once More Round the Sun,asleep-in-the-deep,Brent Hinds,30, I'm on fire  Say you'll remember her voice  And I can't get you out of my mind  I'm on fire  Say you'll remember her voice  And I can't get you out of my mind  I'm on fire  Say you'll remember her voice  And I can't get you out of my mind  I'm on fire  Say you'll remember her voice  And I can't get you out of my mind  
Once More Round the Sun,asleep-in-the-deep,Troy Sanders,30, I'm on fire  Say you'll remember her voice  And I can't get you out of my mind  I'm on fire  Say you'll remember her voice  And I can't get you out of my mind  I'm on fire  Say you'll remember her voice  And I can't get you out of my mind  I'm on fire  Say you'll remember her voice  And I can't get you out of my mind  
Once More Round the Sun,asleep-in-the-deep,Brann Dailor,24, Loose lips have fallen on deaf ears  Loose lips have fallen on blind eyes  
Once More Round the Sun,asleep-in-the-deep,Troy Sanders,32, I'm on fire  Say you'll remember her voice  And I can't get you out of my mind  I'm on fire  Say you'll remember her voice  And I can't get you out of my mind  I'm on fire  Say you'll remember her voice  And I can't get you out of my mind  I'm on fire  Say you'll remember her voice  And I can't get you out of my mind 
Once More Round the Sun,asleep-in-the-deep,Brent Hinds,32, I'm on fire  Say you'll remember her voice  And I can't get you out of my mind  I'm on fire  Say you'll remember her voice  And I can't get you out of my mind  I'm on fire  Say you'll remember her voice  And I can't get you out of my mind  I'm on fire  Say you'll remember her voice  And I can't get you out of my mind 
Once More Round the Sun,asleep-in-the-deep,Brann Dailor,32, I'm on fire  Say you'll remember her voice  And I can't get you out of my mind  I'm on fire  Say you'll remember her voice  And I can't get you out of my mind  I'm on fire  Say you'll remember her voice  And I can't get you out of my mind  I'm on fire  Say you'll remember her voice  And I can't get you out of my mind 
Once More Round the Sun,aunt-lisa,Brann Dailor,56,"  I don't see the fearsome fright  All I see is beauty shine  Not much time to say goodnight  I can hear you scream in the sky  Nephew do you feel all right  Always up in overdrive  They would try to smother you  Never let your feelings through  Where you go, you wonder if you live out loud Where you go, you wonder if you live out loud  Where you go, you wonder if you live out loud  "
Once More Round the Sun,aunt-lisa,Brent Hinds,31,  I'm sniffing your garden  I'm sniffing your rose  She's stuck in the middle  You know how it goes  They're crawling across now  They'll give him some blow  We'll do him a favor  We'll give him some gold  
Once More Round the Sun,aunt-lisa,Brann Dailor,58,"  I remember your eyes came out  I can see you run and shout  Don't know where to place the blame  You knew how to hide your pain  We just want to see you alive  Taught me how to speak my mind  Release you in atmosphere  It was just too small in here  Where you go, you wonder if you live out loud  Where you go, you wonder if you live out loud  Where you go, you wonder if you live out loud  "
Once More Round the Sun,aunt-lisa,Brent Hinds,26,  Live out loud now  We don't live in silence when we live out loud now  We live on the journey  You go with them  
Once More Round the Sun,aunt-lisa,Guest,34,  Hey! Ho!  Let's fucking go  Hey! Ho!  Let's get up and rock n' roll Hey! Ho!  Let's fucking go  Hey! Ho!  Let's get up and rock n' roll Hey! Ho!  Let's fucking go  Hey! Ho!  Let's get up and rock n' roll 
Once More Round the Sun,chimes-at-midnight,Troy Sanders,46," I saw the mountain crumble down  I saw colossus in flames  I heard the ocean draining  Nothing that I could ever tame  Off with my head, come down the line  I have the right to decide  I'll bring this light, as is the sky  Altered minds they criticize  "
Once More Round the Sun,chimes-at-midnight,Troy Sanders,32," Unrest within your flesh  How can we stop this pollution? Altering trouble, you cannot fix  Envy of others never makes me rich  All my heroes, they're all dead  As I remain here inside my  "
Once More Round the Sun,chimes-at-midnight,Brent Hinds,23, We have heard the chimes at midnight  Into the void I go  Will I ever see your face again? Or will black be all I know? 
Once More Round the Sun,chimes-at-midnight,Troy Sanders,62," Arriving inside  Our hearts alive  And the darkness here is grim  But it found us, surrounded  Lead me deep into the canyon  You put your guidance in the wrong hands  Feet ungrounded, giving your best  Now take your gold into silence  You take a stand, bracing yourself  For this cold is never ending  "
Once More Round the Sun,chimes-at-midnight,Brent Hinds,23, We have heard the chimes at midnight  Into the void I go  Will I ever see your face again? Or will black be all I know? 
Once More Round the Sun,chimes-at-midnight,Troy Sanders,14, Arriving inside  Ire hurst a life! 
Once More Round the Sun,diamond-in-the-witch-house,Troy Sanders,17, Wide is the line  Separates the rivers from the dirt  All the while I wonder who's the one 
Once More Round the Sun,diamond-in-the-witch-house,Scott Kelly,21, Within the one and only eye  Within the one and only eye  Within the one and only eye  Within the one and only eye 
Once More Round the Sun,diamond-in-the-witch-house,Troy Sanders,19, Can you see there's a child  Standing idle by us in this mess  Who am I to cause this emptiness 
Once More Round the Sun,diamond-in-the-witch-house,Scott Kelly,31, Willing the sea  To cleanse my soul of all I've been  To bring me free to this clarity  Clarity 
Once More Round the Sun,diamond-in-the-witch-house,Troy Sanders,18," Trouble rolls in  As the tides, they twist and make the turn  Pain subsides and sweeps across the earth again "
Once More Round the Sun,diamond-in-the-witch-house,Scott Kelly,32, Willing the sea  To cleanse my soul of all that I've been  To bring me free to this clarity  Clarity  
Once More Round the Sun,diamond-in-the-witch-house,Scott Kelly,21, Within the one and only eye  Within the one and only eye  Within the one and only eye  Within the one and only eye  
Once More Round the Sun,diamond-in-the-witch-house,Scott Kelly,40, I'm standing deep in these waters  Bleeding free and bent to drag us onto new visions  Only loss fills my void  Only loss fills my void  Only loss fills my void  
Once More Round the Sun,diamond-in-the-witch-house,Scott Kelly,96," Only the void connects me  With these mountains of dust, blood and soil  The stones born in the flames of truth  Demand a sacrifice  A sacrifice  A sacrifice  Don't just bleed us and leave us to ourselves  We will return so deeply harmed, and we will shatter you And we will shatter you And we will shatter you "
Once More Round the Sun,ember-city,Troy Sanders,25,  You walk with boundless grace  Think old thoughts from yesterday  All being lost in the fire  You wandered and lost the way  Someone's always left behind  When the door of life closes  
Once More Round the Sun,ember-city,Brann Dailor,25,  And you were slipping away  What do I say to you  What do I say to you  And if I want you to stay  What do I say to you? What do I say to you? 
